{
  "schema": "distributed_world_simulator.harness_human_attention.v1",
  "decision_id": "HA-V0-MVP-CLOSURE-THROUGHPUT-R1",
  "program": "V0",
  "checkpoint": "V0_PLAYABLE_SEAMLESS_PLANET_COMPOSITION_ACCEPTANCE",
  "risk_class": "CRITICAL",
  "reason": "DIRECTOR_REQUIRES_PRODUCT_OR_ARCHITECT_CHOICE: MVP5 analysis showed closure latency dominated by control/evidence orchestration rather than product implementation. The current Harness rejects stronger Work Order predicate refinements by exact-list equality, allows a preferred unavailable verifier route to stall in practice, and an exact-SHA control-drive job runs on detached HEAD even though Drive requires the declared branch identity.",
  "decision_required": "Authorize a bounded Harness/control repair that preserves exact-head evidence, independent roles, full required product gates and the single runtime mutation writer while allowing stronger acceptance refinements, parallel read-only post-freeze gates, fail-forward verifier routing and branch-aware control-drive execution.",
  "options": ["AUTHORIZE_BOUNDED_CLOSURE_THROUGHPUT_REPAIR", "KEEP_CURRENT_SERIAL_CLOSURE_BEHAVIOR"],
  "recommended_option": "AUTHORIZE_BOUNDED_CLOSURE_THROUGHPUT_REPAIR",
  "recommendation_reason": "The repair removes orchestration false negatives and waiting without weakening runtime acceptance, ownership, review independence or canonical-main merge gates.",
  "blast_radius": ["Harness acceptance-refinement compatibility tests", "post-freeze review/verification routing policy", "MVP exact control-drive workflow", "control-only documentation and tests"],
  "blocking": false,
  "status": "RESOLVED",
  "resolution": "AUTHORIZE_BOUNDED_CLOSURE_THROUGHPUT_REPAIR. Пользователь явно поручил внести правки, чтобы ускорить закрытие пунктов и убрать бюрократию после анализа MVP5. Разрешены только control/policy/test/workflow изменения из V0-MVP-R1-WO-002; runtime gameplay, canonical owners, architecture ownership, acceptance threshold weakening, main merge and self-acceptance не разрешены.",
  "evidence_paths": ["config/control/harness/executions/E2026-09-09-V0-MVP-R1/work-orders/V0-MVP-R1-WO-002.v1.json", "docs/control/HARNESS_CLOSURE_THROUGHPUT_R1_RU.md"]
}